{
  "body_id": "uk-state-body-foreign-commonwealth-development-office",
  "end_date": null,
  "is_current": true,
  "last_reviewed": null,
  "notes": null,
  "office_id": "office-uk-special-envoy-on-preventing-sexual-violence-in-conflict",
  "person_name": "Chris Elmore MP",
  "person_role_id": "personrole-uk-special-envoy-on-preventing-sexual-violence-in-conflict-chris-elmore",
  "record_status": "extracted",
  "source_ids": [
    "source-official-dataset-govuk-content-api"
  ],
  "start_date": "2026-06-19"
}
