{
  "body_id": "uk-state-body-office-of-the-leader-of-the-house-of-lords",
  "end_date": null,
  "is_current": true,
  "last_reviewed": null,
  "notes": null,
  "office_id": "office-uk-special-envoy-for-lgbt-rights",
  "person_name": "Lord Collins of Highbury",
  "person_role_id": "personrole-uk-special-envoy-for-lgbt-rights-collins-of-highbury",
  "record_status": "extracted",
  "source_ids": [
    "source-official-dataset-govuk-content-api"
  ],
  "start_date": "2026-06-29"
}
