{
  "body_id": "uk-state-body-department-for-culture-media-and-sport",
  "end_date": null,
  "is_current": true,
  "last_reviewed": null,
  "notes": null,
  "office_id": "office-secretary-of-state-for-culture-media-and-sport-3",
  "person_name": "The Rt Hon Lisa Nandy MP",
  "person_role_id": "personrole-secretary-of-state-for-culture-media-and-sport-3-lisa-nandy",
  "record_status": "extracted",
  "source_ids": [
    "source-official-dataset-govuk-content-api"
  ],
  "start_date": "2024-07-05"
}
