{
  "body_id": "uk-state-body-department-for-business-and-trade",
  "end_date": null,
  "is_current": true,
  "last_reviewed": null,
  "notes": null,
  "office_id": "office-president-of-the-board-of-trade",
  "person_name": "The Rt Hon Peter Kyle MP",
  "person_role_id": "personrole-president-of-the-board-of-trade-peter-kyle",
  "record_status": "extracted",
  "source_ids": [
    "source-official-dataset-govuk-content-api"
  ],
  "start_date": "2025-09-05"
}
