{
  "body_id": "uk-state-body-food-standards-agency",
  "end_date": null,
  "is_current": true,
  "last_reviewed": null,
  "notes": null,
  "office_id": "office-head-food-standards-agency",
  "person_name": "Emily Miles",
  "person_role_id": "personrole-head-food-standards-agency-emily-miles",
  "record_status": "extracted",
  "source_ids": [
    "source-official-dataset-cabinet-office-public-bodies"
  ],
  "start_date": null
}
